sentence	ambig_status	disambiguation_1	disambiguation_2
This is not to say that the world is not a dangerous place.	1	This is not to say that the world is not a dangerous place, because it is.	This is not to say that the world is not a dangerous place, though it may be true.
I am failing English.	1	I am going to fail English.	I currently have a failing grade in English.
The report provides detailed evidence of the progress made in the last year.	1	The report provides detailed evidence of the good progress made in the last year.	The report provides detailed evidence of the kind of progress made in the last year.
An enranged cow injured a farmer with an ax.	1	An enranged cow used an ax to injure a farmer.	An enranged cow injured a farmer who had an ax.
I don't think that's a very good idea.	1	I think that's a bad idea.	I don't think that's a very good idea, but it may not be a bad one.
The conference will be held in Detroit on October 12.	1	The conference will be held in Detroit, starting on October 12.	The conference will be held in Detroit on October 12 and potentially other dates.
Today it is possible to buy cheap papyrus printed with gaudy Egyptian scenes in almost every souvenir shop in the country, but some of the most authentic are sold at The Pharaonic Village in Cairo where the papyrus is grown, processed, and hand-painted on site.	1	Today it is possible to buy cheap papyrus printed with gaudy Egyptian scenes in almost every souvenir shop in the country, but some of the most authentic — maybe even the only authentic — papyrus are sold at The Pharaonic Village in Cairo where the papyrus is grown, processed, and hand-painted on site.	Today it is possible to buy cheap papyrus printed with gaudy Egyptian scenes in almost every souvenir shop in the country. Though there are many places that sell authentic papyrus, some of the most authentic are sold at The Pharaonic Village in Cairo where the papyrus is grown, processed, and hand-painted on site.
I don't know how big the music school is.	1	I don't know how many people attend the music school.	I don't know how big the music school building is.
Sam and Frank gave a talk.	1	Sam and Frank each gave a talk.	Sam and Frank gave a talk together.
George didn’t see a car coming around the bend.	1	There was a car coming around the bend, and George didn't see it.	George didn't see any cars coming around the bend.
The athlete's goal is to get a gold medal.	1	The athlete's main goal is to get a gold medal.	A goal of the athlete is to get a gold medal.
I'm not sure if I understand.	1	I don't understand, unfortunately.	I'm not sure whether I understand or don't understand.
The teacher wrote a quote from Martin Luther King Jr in every student's yearbook.	1	The teacher wrote the same quote from Martin Luther King Jr in every student's yearbook.	The teacher wrote a quote in every student's yearbook, and all the quotes were from Martin Luther King Jr.
The museum is open from 9am to 5pm.	1	The museum is open from 9am to 5pm, and only during those times.	The museum is open from 9am to 5pm, and possibly other hours too.
She took medication until she was 21, then took a seven-year break, which included therapy.	1	She took medication until she was 21, then took a seven-year break, which included a break from therapy.	She took medication until she was 21, then took a seven-year break, during which she still went to therapy.
My roommate and I met the lawyer for coffee, but she became ill and had to leave.	1	My roommate and I met the lawyer for coffee, but the laywer became ill and had to leave.	My roommate and I met the lawyer for coffee, but my roommate became ill and had to leave.
I'm not saying that it's going to be easy, but it's going to be worth it.	1	I'm not saying that it's going to be easy, because it won't be, but it's going to be worth it.	I'm not saying that it's definitely going to be easy, as it may or may not be, but it's going to be worth it.
I wonder how he got the job.	1	I don't know the process he went through to get the job.	I am skeptical that he was qualified to get the job.
In spite of these findings, many people still believe that extraterrestrial life exists.	1	In spite of these findings, many people still believe that extraterrestrial life exists, though many others do not.	In spite of these findings, many people still believe that extraterrestrial life exists; there may or may not be many others who disagree.
I was one of the best students in my class.	1	I was one of the best students in my class, maybe the best.	I was one of the best students in my class, though not the very best.
He always flouts his mother's advice to follow his own dreams.	1	He always flouts his mother's advice, in order to follow his own dreams instead.	He always flouts his mother's advice, which is to follow his own dreams.
I'm not very concerned about it.	1	I'm not particularly concerned about it, though I am a bit concerned.	I'm not concerned about it.
It is our responsibility to ensure that all students have the opportunity to succeed.	1	It is our responsibility to ensure that all students have the opportunity to succeed, which may or may not already be the case.	It is our responsibility to ensure that all students have the opportunity to succeed, which is not the case right now.
In the absence of the relevant facts, it is impossible to say whether or not the man is dead.	1	Being in the absence of the relevant facts, it is impossible to say whether or not the man is dead.	If we should be in the absence of the relevant facts, it is impossible to say whether or not the man is dead.
He always ignores his mother's advice to follow his own dreams.	1	He always ignores his mother's advice, in order to follow his own dreams instead.	He always ignores his mother's advice, which is to follow his own dreams.
He didn't see the big picture.	1	He didn't see the physical big picture.	He didn't see the metaphorical big picture.
A person who has attained success in life has done so by setting and achieving goals.	1	A person who has attained success in life has done so entirely by setting and achieving goals.	A person who has attained success in life has done so by setting and achieving goals, possibly among other necessary components.
The first step to take if you want to improve your writing is to read more.	1	Since you want to improve your writing, the first step to take is to read more.	In the case that you want to improve your writing, the first step to take is to read more.
The aim of the study was to improve the understanding of the factors that influence students' decisions to study abroad.	1	The aim of the study was to improve the understanding of what factors influence students' decisions to study abroad.	The aim of the study was to improve the understanding of known factors influencing students' decisions to study abroad.
He had to stop taking the medication because of the side effects.	1	He was forced to stop taking the medication because of the side effects.	He should have stopped taking the medication because of the side effects, regardless of whether he actually did.
They are not the kind of people who would take advantage of a situation like this.	1	They are not the kind of people who would make unfair use of a situation like this.	They are not the kind of people who would use the opportunity offered by a situation like this.
A study by the American Academy of Pediatrics found that many parents are reluctant to have their children vaccinated.	1	A study by the American Academy of Pediatrics determined that many parents are reluctant to have their children vaccinated.	A study by the American Academy of Pediatrics concluded that many parents are reluctant to have their children vaccinated.
I'm looking for a charger.	1	I'm looking for a lost charger.	I'm looking to acquire a charger.
I hope there are more interactive exhibits in the museum.	1	I hope there are more exhibits that are interactive in the museum.	I hope there are exhibits that are more interactive in the museum.
I'm not saying that she's not beautiful.	1	I'm not saying that she's not beautiful, because she is.	I'm not saying that she's not beautiful, though that may be the case.
The study found that the use of the word \"sucks\" in daily conversation had doubled since 1990.	1	The study discovered that the use of the word \"sucks\" in daily conversation had doubled since 1990.	The study came to the conclusion that the use of the word \"sucks\" in daily conversation had doubled since 1990.
The hospital is being sued by six foot doctors.	1	The hospital is being sued by six podiatrists.	The hospital is being sued by doctors who are six feet tall.
John gave all his students a book on Derrida.	1	John gave all his students copies of the same book on Derrida.	John gave all his students a book, and all the books were on Derrida.
It is important for us to be able to work together in order to make progress.	1	It is important for us to be able to work together and thereby make progress.	If we want to make progress, it is important for us to be able to work together.
In many cases, people who are colorblind can see colors, but they are not as vibrant.	1	In many but not all cases, people who are colorblind can see colors, but they are not as vibrant.	In many, perhaps all cases, people who are colorblind can see colors, but they are not as vibrant.
A significant number of people who live in poverty are children.	1	A significant number of people who live in poverty — maybe even the vast majority — are children.	A significant number of people who live in poverty — though not an overwhelming majority  — are children.
We examine the effect of family structure on child outcomes.	1	We examine the possible effect of family structure on child outcomes.	We examine the established effect of family structure on child outcomes.
My kids might go to the same school as Bill Gates' kids.	1	My kids might, in the future, go to the same school as Bill Gates' kids.	My kids might currently go to the same school as Bill Gates' kids.
Since prehistoric times, people have been using geometry to study the world around them.	1	Since prehistoric times, people have been using geometry to learn about the world around them.	Since prehistoric times, people have been using geometry to try to study the world around them.
He must have been angry.	1	It must be the case that he was angry.	He was probably angry.
No worries, I am just having the usual advisor problems.	1	No worries, I am just having the usual problems that advisors have.	No worries, I am just having the usual problems relating to advisors.
I'm not sure I can do this.	1	I'm not sure whether I can do this.	I can't do this.
The results of the study indicate that a majority of the participants had a positive reaction to the new treatment.	1	The results of the study suggest that a majority of the participants had a positive reaction to the new treatment.	The results of the study demonstrated that a majority of the participants had a positive reaction to the new treatment.
The maid of the princess who scratched herself in public was terribly humiliated.	1	The maid, of the princess who scratched herself in public, was terribly humiliated.	The princess's maid who scratched herself in public was terribly humiliated.
He told me he ate the leftovers yesterday.	1	He told me that yesterday, he ate the leftovers.	He told me yesterday that he ate the leftovers.
Since I took office, Wisconsin now has the 2nd highest health care quality ranking in the country.	1	In the time since I took office, Wisconsin's highest health care quality ranking has improved to 2nd in the country.	I have taken office. Wisconsin currently has the 2nd highest health quality ranking in the country.
I will not be moving with my partner to the new job.	1	It is not the case that my partner and I are both moving to the new job.	My partner is moving to the new job, but I will not be moving with him.
Angie broke the news to her grandma that she has cancer.	1	Angie broke the news to her grandma that Angie has cancer.	Angie's grandma has cancer, and Angie broke the news to her about it.
They would have failed.	1	The expectation is that they would have failed.	If something had been different, they would have failed.
A study conducted by researchers at the University of Michigan found that people who consume a lot of fast food are more likely to be depressed.	1	It was shown in a study conducted by researchers at the University of Michigan that people who consume a lot of fast food are more likely to be depressed.	A study conducted by researchers at the University of Michigan concluded that people who consume a lot of fast food are more likely to be depressed.
This isn't just a simple task.	1	This isn't a simple task.	This is a simple task, and not just that.
The study found that people who slept for less than 7 hours a night were more likely to suffer from depression.	1	The study discovered that people who slept for less than 7 hours a night were more likely to suffer from depression.	The study concluded that people who slept for less than 7 hours a night were more likely to suffer from depression.
It is imperative that the city should have a fire department.	1	It is imperative that the city should establish a fire department.	It is imperative that the city should have a fire department, regardless of whether it already does.
He chose the right side of the fork.	1	He chose the correct side of the fork.	He chose the side of the fork on the right.
We can't wait to see what will happen.	1	We can’t wait to witness what will happen.	We can’t wait to find out what will happen.
The purpose of this paper is to explore the link between reading ability and employment outcomes.	1	The purpose of this paper is to explore the existing link between reading ability and employment outcomes.	The purpose of this paper is to explore the possible link between reading ability and employment outcomes.
The school will be closed tomorrow due to the storm.	1	The school will be closed tomorrow due to the storm itself.	The school will be closed tomorrow due to the impacts of the storm.
I have a lot of friends who are artists.	1	I have a lot of friends who are artists, whether or not all of them are.	I have a lot of friends who are artists, though not all of them are.
Giacomo believes several people in the room are counting cards.	1	There are several individuals in the room who Giacomo believes to be counting cards.	Giacomo believes there are multiple people in the room counting cards.
We must work together to ensure that all children have the opportunity to reach their full potential.	1	We must work together to ensure that all children have the opportunity to reach their full potential, whether or not that's already true.	We must work together to ensure that all children have the opportunity to reach their full potential, as opposed to the current state of affairs.
If you take the time to proofread your work, you will catch most of your errors.	1	If and only if you take the time to proofread your work, you will catch most of your errors.	If you take the time to proofread your work, you will catch most of your errors, though there may be other ways to catch them too.
I'm sorry, but I don't think I can help you.	1	I'm sorry, but I don't think it's true that I can help you.	I'm sorry, but I can't help you.
They were close to finding a cure for the disease.	1	They were close to finding a cure for the disease, which may or may not exist.	They were close to finding a cure for the disease, which exists.
I wanted to believe him, but I just couldn't.	1	I wanted to believe him, but I just couldn't because I knew he was lying.	I wanted to believe him, but I just didn't have enough evidence.
We will be able to see things more clearly then.	1	We will be able to see things more clearly at a later point in time.	As a result, we will be able to see things more clearly.
The study found that the average person reads 25% slower from a screen than from paper.	1	The study showed that the average person reads 25% slower from a screen than from paper.	The study concluded that the average person reads 25% slower from a screen than from paper.
It is disheartening to think that our government would rather build walls than bridges.	1	It is disheartening to consider the possibility that our government would rather build walls than bridges.	It is disheartening that our government would rather build walls than bridges.
The study found that the best way to prevent bullying is to have a zero-tolerance policy.	1	The study concluded that the best way to prevent bullying is to have a zero-tolerance policy.	It was shown by the study that the best way to prevent bullying is to have a zero-tolerance policy.
He ate the cookies on the couch.	1	He ate the cookies that were on the couch.	On the couch, he ate the cookies.
A small number of countries have not yet ratified the treaty.	1	Only a small number of countries have not yet ratified the treaty.	At least a small number of countries have not yet ratified the treaty.
Tanaka and Lilian built a cabin.	1	Tanaka and Lilian each built a cabin.	Tanaka and Lilian built a cabin together.
Twice a car passed while he was fidgeting with the lock of the house.	1	A particular car passed twice while he was fidgeting with the lock of the house.	Two cars passed while he was fidgeting with the lock of the house.
I'm pretty sure that the answer is no.	1	I'm pretty sure, but not completely sure, that the answer is no.	I'm pretty sure, but not completely sure, that the answer is no.
The boy had trouble hearing out of his left ear.	1	The boy had trouble hearing out of his left ear; his right ear has normal hearing.	At least in his left ear, the boy had trouble hearing.
I wonder if the store is open.	1	I wonder if the store has opened for business yet.	I wonder if the store is currently open.
Even if dinner is with Alisa, it’s still worth it.	1	Even if dinner is with Alisa alone, it's still worth it.	Despite that dinner is with Alisa, it's still worth it.
I am confident that we will be able to achieve our goal.	1	I know, as a matter of fact, that we will be able to achieve our goal.	I feel confident that we will be able to achieve our goal.
It is possible that the conference will be postponed if the situation does not improve.	1	It is possible that the conference will be postponed, which will happen if the situation does not improve.	If the situation does not improve, it is possible that the conference will be postponed.
I'm not going to the party because I don't know anyone there.	1	I'm not going to the party because I don't know anyone there, among other possible reasons.	I'm not going to the party, solely because I don't know anyone there.
He's not very well off.	1	He's not very financially well off.	He's not in a very good situation.
I was not so much angry with her as I was disappointed.	1	I was not necessarily angry with her, but I was disappointed.	I was angry with her, but not as much as I was disappointed.
The speaker is at the front of the room.	1	The loudspeaker is at the front of the room.	The person who is speaking is at the front of the room.
John was not at home, and so I couldn't give him the message.	1	John was not at home, and so I couldn't give him the message; otherwise I could have.	John was not at home, and so I couldn't give him the message, but there may or may not have been other obstacles too.
When the clock struck New Year's, John kissed his wife, and so did Sam.	1	When the clock struck New Year's, John kissed his wife, and Sam kissed his wife too.	When the clock struck New Year's, John kissed his wife, and Sam kissed John's wife too.
The athlete was very dehydrated after the race.	1	The athlete became very dehydrated during the race.	The athlete was very dehydrated after the race, though not necessarily because of the race.
You should visit Norway in the summer.	1	You should visit Norway the coming summer.	You should visit Norway in the summer season.
Even if you study hard, you can't expect to get an A on the test.	1	Even if you study hard, you can't expect to get an A on the test, though it is possible.	Even if you study hard, you can't expect to get an A on the test; it may or may not be possible.
Some people believe that extraterrestrial life exists on other planets.	1	Some people, but not many, believe that extraterrestrial life exists on other planets.	Some people, and possibly many, believe that extraterrestrial life exists on other planets.
Because of the drought, the city's water supply will run out in two months.	1	Because of the drought, the city's water supply will run out within two months.	Because of the drought, the city's water supply will run out in exactly two months.
The doctor told me that I had a rare disease.	1	The doctor informed me that I had a rare disease.	The doctor said to me that I had a rare disease.
I am getting more and more tired.	1	I am becoming more and more in need of rest.	I am becoming more and more uninterested.
It is not clear whether the city will be able to attract enough businesses to fill all the available space.	1	It is not clear whether the city would attract enough businesses to fill all the available space.	It is not clear whether the city will fulfill its goal of attracting enough businesses to fill all the available space.
I'm getting a little sick of your complaints.	1	I'm getting a little sick of the contents of your complaints.	I'm getting a little sick of how much you complain.
The effects of the disease are not yet fully understood.	1	The effects of the disease on the body are not yet fully understood.	The larger impacts of the disease are not yet fully understood.
No bathroom bill made it to Abbott’s desk by the end of the legislative session in May.	1	Of the bills that made it to Abbott’s desk by the end of the legislative session in May, none of them were bathroom bills.	No bathroom bill made it to Abott's desk by the end of the legislative session in May, whether or not other bills did.
The students were asked to complete the assignment by the end of the week.	1	The students were asked to complete the assignment by a certain time that is before the end of the week.	The students were asked to complete the assignment by a certain time that happens to be the end of the week.
Social media has had a profound effect on the way we communicate.	1	Social media has had a dramatic effect on the way we communicate.	Social media has had a deeply interesting effect on the way we communicate.
I want to go to a school in Chicago.	1	There is a school that I want to go to, and it is in Chicago.	I want to go to school in Chicago.
I am not trying to say that we should all go out and buy a new car.	1	I am not necessarily saying that we should all go out and buy a new car.	I do not believe that we should all go out and buy a new car.
The man was running towards the finish line.	1	The man was running in the direction of the finish line.	The man was running to reach the finish line.
The most likely explanation for the decline in support for the war is that the American public has lost faith in the government's ability to win the war.	1	The American public has lost faith in the government's ability to win the war, which is the most likely explanation for the decline in support for the war.	The most likely explanation for the decline in support for the war is the possibility that American public has lost faith in the government's ability to win the war.
In spite of the recession, many people are still going out to eat at restaurants.	1	In spite of the recession, many people are still going out to eat at restaurants relative to before.	In spite of the recession, there exists many people who are still going out to eat at restaurants.
It is the only possibility of making the law the servant of the people, not the other way around.	1	It is the only possibility of making the law the servant of the people, as it should be, and not the other way around.	It is the only possibility that would lead to the law being the servant of the people, not the other way around.
I am going to pick up my brother from school.	1	I am going to pick up just my brother from school.	I am going to pick up my brother from school, possibly among others.
The cat slept through the storm.	1	The cat slept through the duration of the storm.	The storm did not wake up the cat.
It's going to be hot today.	1	It’s not hot right now but it’s going to be hot today.	It’s not hot right now but it’s going to be hot today.
Even the best-laid plans can go awry.	1	Even the best-laid plans can go awry, though usually they are successful.	Even the best-laid plans can go awry; in fact, they may never be successful.
I hope there is more contemporary music on the rest of the program.	1	I hope there is more music that is contemporary on the rest of the program, too.	I hope there is music that is more contemporary on the rest of the program.
They never suspected that their new babysitter was a murderer.	1	They never saw it coming that their new babysitter was a murderer.	They never considered whether their new babysitter was a murderer.
He was relieved.	1	He was no longer feeling distressed.	He was let go.
I can't remember when I last had a good laugh.	1	I can't remember when I last had a good laugh; it has been a long time.	I can't recall when I last had a good laugh, though it may have been recently.
The disease is passed on by the bite of an infected mosquito.	1	The disease is only passed on by the bite of an infected mosquito.	The disease is passed on by the bite of an infected mosquito, possibly among other ways.
