sentence	ambig_status	disambiguation_1	disambiguation_2
The coffee beans are roasted and then ground up before being brewed.	1	Before being brewed, exactly two things happen to the coffee beans: they are roasted, and then ground up.	Before being brewed, several things happen to the coffee beans, including being roasted and then ground up.
If a person has a right to life, then that person has a right to the basic necessities of life.	1	Since a person has a right to life, that person has a right to the basic necessities of life.	If it is true that a person has a right to life, then that person must have a right to the basic necessities of life.
Jana wants to marry the tallest man in Fulsom County.	1	Jana wants to marry the tallest man in Fulsom County, whoever that may be.	Jana wants to marry someone who happens to be the tallest man in Fulsom County.
I saw a man with binoculars.	1	I saw a man who had binoculars.	I used binoculars to see a man.
In recent years, the NFL has confronted accusations of racial discrimination by Black coaches, allegations of workplace misconduct at a flagship franchise and posthumous diagnoses in more than 300 former players of chronic traumatic encephalopathy, which is associated with repeated blows to the head.	1	In recent years, the NFL has confronted accusations from Black coaches of racial discrimination, allegations of workplace misconduct at a flagship franchise and posthumous diagnoses in more than 300 former players of chronic traumatic encephalopathy, which is associated with repeated blows to the head.	In recent years, the NFL has confronted accusations of racial discrimination at the hands of Black coaches, allegations of workplace misconduct at a flagship franchise and posthumous diagnoses in more than 300 former players of chronic traumatic encephalopathy, which is associated with repeated blows to the head.
A lot of people are under the impression that the stock market is a place where you can make a lot of money quickly.	1	A lot of people are under the mistaken impression that the stock market is a place where you can make a lot of money quickly.	A lot of people think that the stock market is a place where you can make a lot of money quickly.
I'm looking for a black wallet.	1	I'm looking for a lost black wallet.	I'm looking to acquire a black wallet.
He didn't mean to hurt her feelings.	1	He didn't mean to hurt her feelings, but he did.	He didn't mean to hurt her feelings, whether or not he did.
I'm not going to sugarcoat this: you need to shape up or you're going to get fired.	1	I'm not going to sugarcoat this: if you don't shape up, it will cause you to get fired.	I'm not going to sugarcoat this: one of the two possibilities is true — you're going to get fired, or you need to shape up.
He sightread the piece with a lot of F naturals.	1	He sightread the piece that contains a lot of F naturals.	He played a lot of F naturals when sightreading the piece.
They will also be asked to decide whether the verdict should be set aside.	1	They will also be asked to decide whether the verdict is still valid.	They will also be asked to decide whether the verdict should be set aside temporarily.
He told me the story of a man who played piano quickly.	1	He told me the story quickly, of a man who played piano.	He told me the story of a man, who played piano quickly.
The proposal is that we increase our investment in the company by 10%.	1	Our proposal is that we increase our investment in the company by 10%.	Their proposal is that we increase our investment in the company by 10%.
I swore to myself.	1	I cussed to myself.	I promised to myself.
We can be sure that the future will be better than the present.	1	It is certain that the future will be better than the present.	We can feel certain that the future will be better than the present.
John and Jim are married.	1	John and Jim are both married.	John and Jim are married to each other.
The store is having a sale on winter clothing.	1	The store is having a sale on winter clothing, and perhaps on other things too.	The store is having a sale specifically on winter clothing.
There is no evidence that the policy has been successful in reducing the number of accidents.	1	There exists no evidence that the policy has been successful in reducing the number of accidents.	There is no evidence collected yet that the policy has been successful in reducing the number of accidents.
I will not vote for the candidate.	1	I will vote, but not for the candidate.	I will not vote for the candidate, if I vote.
The boat, now caught in the storm, seemed to be in danger of capsizing.	1	The boat, now caught in the storm, appeared to be in danger of capsizing.	The boat, now caught in the storm, was in danger of capsizing.
He told me the issue was resolved yesterday.	1	He told me that yesterday, the issue was resolved.	He told me yesterday that the issue was resolved.
It is currently March, and they plan to have their wedding scheduled for next December.	1	It is currently March, and they plan to have their wedding scheduled for the coming December.	It is currently March, and they plan to have their wedding scheduled for December next year.
It is good to know that someone has your back.	1	It is good to know that in fact, someone has your back.	It is a good feeling to know that someone has your back.
It was not until the early hours of the morning that the true extent of the damage was known.	1	It was not until the early hours of the morning that the true extent of the damage was known, though it was known earlier that there was damage.	It was not until the early hours of the morning that the true extent of the damage was known, though it was known earlier that there was damage.
They have a reputation for being a very reliable source of information.	1	They are widely thought to be a very reliable source of information.	They are a very reliable source of information, and well-known for it.
Due to the company's success, many of its employees have become millionaires.	1	Due to the company's success, many of its employees have become millionaires, though not a large fraction overall.	Due to the company's success, many of its employees have become millionaires. In fact, perhaps there are not many who did not.
I hope you had a well-deserved break.	1	I hope you deserved your break.	I hope you had a break, which you deserved to have.
If a business is doing well, its stock price may increase.	1	Even if a business is doing well, its stock price may or may not increase.	If a business is doing well, this would increase the chances that its stock price increases.
The company's IT systems must be able to integrate with the new software.	1	The company's IT systems need to be able to integrate with the new software.	It must be the case that the company's IT systems are able to integrate with the new software.
The man was trying to improve his health by exercising and eating better.	1	The man was trying to improve his health only by exercising and eating better.	The man was trying to improve his health by exercising and eating better (among possibly other measures).
In the past, people thought that the Earth was the center of the universe.	1	In the past, people thought that the Earth was the center of the universe, but people now don't think that anymore.	In the past, people thought that the Earth was the center of the universe, and people now may or may not still think that.
We will be able to increase our production by 10 percent if we can get the additional machinery.	1	We will be able to increase our production by 10 percent, but only if we can get the additional machinery.	We will be able to increase our production by 10 percent if we can get the additional machinery, but it is possible that we are able to do this without the machinery too.
The company has been in trouble for some time, and its stock prices have been falling steadily.	1	The company has been in trouble for some time, which has caused its stock prices to fall steadily.	The company has been in trouble for some time, and also its stock prices have been falling steadily.
The law is a bit like a game, in that there are rules that must be followed in order to win.	1	The law is a bit like a game, and even maybe it is a game, in that there are rules that must be followed in order to win.	The law is a bit like a game, but it is not a game, in that there are rules that must be followed in order to win.
I can't believe that he ate an entire pizza by himself.	1	I refuse to believe that he ate an entire pizza by himself.	I am shocked that he ate an entire pizza by himself.
I'm not sure if I'm ready to make that commitment.	1	I'm not sure whether I'm ready to make that commitment or not.	I'm not ready to make that commitment.
I don't know if I should tell her the truth.	1	I don't know if I should tell her the truth or a lie.	I don't know if I should tell her the truth or a lie.
The dog's owner decided to put the dog down because it was too old and sick.	1	The dog's owner decided to put the dog down solely because it was too old and sick.	The dog's owner decided to put the dog down partly because it was too old and sick.
I am not saying that he is a bad person, but I am saying that he is not a good person.	1	I acknowledge that he is not a bad person, but I am saying that he is not a good person.	I am not arguing that he is a bad person, but I am saying that he is not a good person.
In general, older adults are more likely to suffer from chronic illnesses than younger adults.	1	In general, older adults are more likely to suffer from chronic illnesses than younger adults, but there are exceptions.	In general, perhaps always, older adults are more likely to suffer from chronic illnesses than younger adults.
This law is designed to protect the environment.	1	This law is designed mainly to protect the environment.	This law is designed to protect the environment, possibly among other goals.
The study found that there was a correlation between anxiety and academic performance.	1	The study showed that there was a correlation between anxiety and academic performance.	The study concluded that there was a correlation between anxiety and academic performance.
It is becoming increasingly difficult to find people who have not been affected by the change.	1	It is becoming increasingly difficult to locate people who have not been affected by the change.	People who have not been affected by the change are becoming increasingly rare.
It should be right now.	1	It should be correct now.	It should be at this moment.
The company's new product is projected to increase sales by 20%.	1	The company's new product, if successful, is projected to increase sales by 20%.	The company's new product is projected to increase sales by 20%, though this may not depend on the product's success.
The professor said on Monday he would give an exam.	1	The professor said on Monday that he would give an exam.	The professor said that on Monday, he would give an exam.
Patrick did not manage to leave.	1	Patrick did not manage to leave, despite his attempt.	Patrick did not manage to leave, whether or not he tried.
It is my belief that the earth is round.	1	It is my understanding that the earth is round.	It is my conviction that the earth is round.
We can use this definition to help us see when we are acting selfishly.	1	We can use this definition to help us see when we are acting selfishly, and when we are not.	We can use this definition to help us identify some cases of when we are acting selfishly.
All things being equal, she would have chosen the job in New York.	1	If the situation were different such that all things were equal, she would have chosen the job in New York.	All things being equal, she would have chosen the job in New York, and she may have.
A review of the literature indicates that there is a great deal of research on the topic of job satisfaction.	1	Reviewing the literature would reveal that there is a great deal of research on the topic of job satisfaction.	A particular review of the literature indicates that there is a great deal of research on the topic of job satisfaction.
I forgot what room I'm in.	1	I forgot what room I'm physically in.	I forgot what room I belong to.
All of the members of the team had to be replaced.	1	All of the members of the team had to be replaced, and they were.	All of the members of the team needed to be replaced.
