sentence	ambig_status	disambiguation_1	disambiguation_2
Education is expensive, and most students cannot pay for it without loans.	1	Education is expensive, and most students take out loans to pay for it, out of necessity.	Education is expensive, and most students would have to take out loans to pay for it.
In order to solve this problem, the engineers needed to create a computer model that could take into account the flow of water, wind, and other factors.	1	In order to solve this problem, the engineers created a computer model that could take into account the flow of water, wind, and other factors.	In order to solve this problem, the engineers needed to computer model that could take into account the flow of water, wind, and other factors, whether or not they succeeded.
It is not clear that a one-size-fits-all approach is the best way to deal with the problem.	1	It is not obvious whether a one-size-fits-all approach is the best way to deal with the problem.	It is difficult to realize that a one-size-fits-all approach is the best way to deal with the problem.
The evidence does not support the conclusion that the intervention was effective.	1	The evidence does not support the conclusion reached, which was that the intervention was effective.	The evidence does not support a possible conclusion that the intervention was effective.
It's not just because she's the boss's daughter that she gets whatever she wants.	1	It's not only because she's the boss's daughter that she gets whatever she wants; there are other factors too.	It's the simple reason that she's the boss's daughter that explains how she gets whatever she wants.
It is hard to believe that a show that was once so popular is now struggling to find viewers.	1	It is hard to believe the fact that a show that was once so popular is now struggling to find viewers.	It is doubtful that a show that was once so popular is now struggling to find viewers.
The more you practice, the better you'll get.	1	The more you practice, the better you'll get; practice is necessary for getting better.	The more you practice, the better you'll get, though there may be other ways of getting better, too.
The fact that there are many different types of glass is evidence that it is a popular material.	1	The fact that there are many different types of glass is evidence for the fact that it is a popular material.	The fact that there are many different types of glass is evidence for the hypothesis that it is a popular material.
A number of my friends have been affected by the recent lay-offs.	1	A number of my friends, though not all of them, have been affected by the recent lay-offs.	A number of my friends, possibly all of them, have been affected by the recent lay-offs.
The new hospital is close to the interstate, making it easy for patients to get there.	1	The new hospital is close to the interstate, making it easy for patients to get to the hospital.	The new hospital is close to the interstate, making it easy for patients to get to the interstate.
In some cases, the company's treasurer may be authorized to borrow funds on behalf of the company.	1	In some cases, the company's treasurer might be authorized to borrow funds on behalf of the company.	In some cases, the company's treasurer is allowed to be authorized to borrow funds on behalf of the company.
The research shows that happy people are more likely to be successful.	1	Research has proved that happy people are more likely to be successful.	The particular piece of research concludes that happy people are more likely to be successful.
The study found that people who are more conscientious are more likely to be successful.	1	The study showed that people who are more conscientious are more likely to be successful.	The study concluded that people who are more conscientious are more likely to be successful.
I've only lived in the northern part of Seattle.	1	In Seattle, I've only lived in the northern part.	I haven't lived anywhere in the world besides the northern part of Seattle.
It is not that I don't want to see the movie, it is that I don't have time.	1	I want to see the movie, but I don't have time.	It is not necessarily the case that I don't want to see the movie, it is that I don't have time.
We need to be able to adapt to the changing world around us.	1	We need to adapt to the world around us that is constantly changing.	We need to be able to adapt to the world around us when it changes.
She wants to work with the professor with the largest citation count in the department.	1	She wants to work with whichever professor in the department has the largest citation count.	She wants to work with a professor who happens to have the largest citation count in the department.
I can't remember when I last saw her.	1	I can't remember when I last saw her; it has been a long time.	I can't recall when I last saw her.
He is such a talented musician that he could have been a professional.	1	He is such a talented musician that he might have been a professional.	He is such a talented musician that he could have become a professional.
Just because I don't agree with you doesn't mean I hate you.	1	Despite not agreeing with you, that doesn't mean I hate you.	Merely not agreeing with you doesn't mean I hate you.
The easiest way to solve the problem is to call a meeting.	1	The easiest way to solve the problem is to call a meeting, but there are other ways.	The easiest way to solve the problem, perhaps the only way, is to call a meeting.
The union and the company have not been able to agree on a new contract.	1	The union and the company have not been able to agree on a new contract during ongoing negotiations.	The union and the company have differing opinions on what might go in a new contract.
The company's expansion plans are to open new stores in the US.	1	The company's expansion plans are to open more stores in the US.	The company's expansion plans are to open stores in the US for the first time.
A woman in this neighborhood gives birth every year.	1	There is a particular woman in this neighborhood who gives birth every year.	Every year, some woman in this neighborhood gives birth.
I know that someone here is lying.	1	There is someone here who I know to be lying.	I know that someone here is lying, though not necessarily who it is.
She said that she will pick me up at 4pm and I can leave at 6pm.	1	She said that she will pick me up at 4pm and that I can leave at 6pm.	She said that she will pick me up at 4pm; I can leave at 6pm.
John opened the door again.	1	The door was open before, and John opened the door again.	John opened the door before, and did it again.
The class will discuss how to write a research paper.	1	The class is about how to write a research paper.	The class will, at some point, discuss how to write a research paper.
I don't taste anything fishy.	1	I don't taste anything suspicious.	I don't taste anything similar to fish.
I think that the new software is not very user-friendly.	1	I think that the new software is not exceptionally user-friendly, though it may be somewhat user-friendly.	I think that the new software is not user-friendly.
A large number of people were not willing to take the risk.	1	A large number of people, and possibly all people, were not willing to take the risk.	A large number of people, but not all people, were not willing to take the risk.
It is important to remember that not all of the people who emigrated to the United States in the late 1800s were poor.	1	It is important to remember that although many of the people who emigrated to the United States in the late 1800s were poor, not all of them were.	It is important to remember that it is not the case that all of the people who emigrated to the United States in the late 1800s were poor.
If the rock is too big, we can't move it.	1	If the rock is too big, we can't move it; otherwise we can.	If the rock is too big, we can't move it, and there may be other preventative factors too.
The high school students who were most likely to report drinking had more friends who drank.	1	The high school students who were most likely to report drinking had a great number of friends who drank.	The high school students who were most likely to report drinking had a greater proportion of friends who drank.
I was uninterested in the book, and didn't finish it.	1	I was uninterested in the book, and didn't finish it (not to address the question of whether I started it at all).	I was uninterested in the book, and didn't finish it despite starting.
That's why we tried to kill you.	1	That's the single reason we tried to kill you.	That's one reason we tried to kill you; there may be more reasons.
He is upset at his friend for revealing private information about his relationship to his teacher.	1	He is upset at his friend for revealing to his teacher private information about his relationship.	He is upset at his friend for revealing private information, concerning his relationship to his teacher.
The majority of Georgians incarcerated in local jails have never been convicted of crime. They are simply too poor to pay their bail.	1	The majority of Georgians incarcerated in local jails are not there because they were convicted of crime. They are simply too poor to pay their bail.	The majority of Georgians incarcerated in local jails have never been convicted of crime in their entire lives. They are simply too poor to pay their bail.
It was not until the 17th century that the city began to grow rapidly.	1	It was not until the 17th century that the city began to grow rapidly, though it may have been founded much earlier.	It was not until the 17th century that the city began to grow rapidly, though it existed before then.
The editor did not find many mistakes in the paper.	1	There were many mistakes in the paper that the editor did not find.	The editor searched for mistakes in the paper and did not find many.
The jury returned a verdict of guilty for first degree murder.	1	The jury returned a single verdict of guilty for first degree murder.	The jury returned a verdict of guilty for first degree murder, possibly among other verdicts.
The professor admitted that no students wrote course evaluations, which is surprising.	1	It is surprising that the professor admitted that no students wrote course evaluations.	The professor admitted the surprising fact that no students wrote course evaluations.
Lilian and Tanaka have two balloons.	1	Lilian and Tanaka each have two balloons.	Lilian and Tanaka have two balloons, together.
In a democracy, the will of the people is supposed to be reflected in the government.	1	In a democracy, the will of the people is supposed to be reflected in the government, even though it isn't always.	In a democracy, the will of the people is supposed to be reflected in the government, whether or not it always is.
We all know that exercise is good for us, but few of us actually make the time to do it.	1	We specifically know that exercise is good for us, but few of us actually make the time to do it.	Everyone knows that exercise is good for us, but few of us actually make the time to do it.
The survey found that more than a third of Americans have a negative view of the news media.	1	The survey concluded that more than a third of Americans have a negative view of the news media.	The survey concluded that more than a third of Americans have a negative view of the news media.
These snakes get their name from the beautifully changing pattern on their bodies.	1	These snakes get their name from the beautifully changing pattern along their bodies.	These snakes get their name from the pattern on their bodies which beautifully changes over time.
In many ways, the American Revolution was a direct result of the Seven Years' War.	1	In many ways, though possibly not all ways, the American Revolution was a direct result of the Seven Years' War.	In many ways, though not all ways, the American Revolution was a direct result of the Seven Years' War.
The animal was not injured in the accident.	1	Though the animal was in the accident, it was not injured.	The animal was not injured in the accident, whether or not it was in the accident at all.
A possible explanation for his anger is that he was passed over for the promotion.	1	He was passed over for the promotion, which is a possible explanation for his anger.	It is possible that he was passed over for the promotion, which would explain his anger.
If an employee is fired for cause, the employer is not required to give the employee a severance package.	1	If an employee is fired for a cause, the employer is not required to give the employee a severance package; otherwise, the employer is required to do so.	At least in the case where an employee is fired for cause, the employer is not required to give the employee a severance package.
I always feel more comfortable when I am at home.	1	I always feel more comfortable when I am at home than anywhere else.	I always feel very comfortable when I am at home.
It was raining, so I stayed home.	1	It was raining, so I stayed home; otherwise I would have gone outside.	It was raining, so I stayed home, though there may have been other reasons too.
The data provides evidence that the treatment is effective.	1	The data provides evidence indicating that the treatment is effective.	The treatment is effective, and the data provides evidence for it.
They were driving too fast, and they got pulled over.	1	They were driving too fast, so they got pulled over.	They were driving too fast; also they got pulled over.
Then he sobered.	1	Then he became more sensible.	Then he sobered after drinking alcohol.
The market was empty of pork, grains, and all foods that were banned.	1	The market was empty of pork, grains, as well as all foods that were banned.	The market was empty of pork and grains, and all other foods that were banned.
This year has been a trying one for the country, with a devastating hurricane and an ongoing drought.	1	This year has been a trying one for the country, including a devastating hurricane and an ongoing drought.	This year has been a trying one for the country, because of a devastating hurricane and an ongoing drought.
They have a lot of friends in common.	1	They have a lot of friends in common, though they are not friends directly.	They have a lot of friends in common, whether or not they are friends themselves.
I think that it is a good idea.	1	I think that it is a good idea, and may or may not be a great one.	I think that it is a good, but not great, idea.
I heard that the cat was stuck in the tree.	1	I heard someone say that the cat was stuck in the tree.	I heard the sound of the cat stuck in the tree.
The vast majority of people who contract the virus will experience only mild or moderate symptoms.	1	The vast majority of people who contract the virus will experience only mild or moderate symptoms, though some will experience more severe ones.	The vast majority of people who contract the virus will experience only mild or moderate symptoms, though some will experience more severe ones.
It was as if she had been possessed by a demon.	1	She was acting like she had been possessed by a demon.	It was as if she had been possessed by a demon, though she was not.
The main goal is to find a cure for cancer.	1	The main goal is to find a cure for cancer as a disease, which may include preventing cancer in the first place.	The main goal is to find a cure for cancer after it has developed in the body.
She needed to know only what he told her.	1	He is the only one who told her what she needed to know.	What he told her is all she needed to know.
It is clear that our current education system is not preparing students for the real world.	1	It is clear that our current education system is not preparing students for the real world, which it should do.	It is clear that our current education system is not preparing students for the real world, whether or not that should be the aim.
It is hard to work together when you don't speak the same language.	1	It's hard to work together when you literally don't speak the same language.	It's hard to work together when you don't understand one another well.
We cannot simply sit by and watch as the world around us crumbles.	1	We cannot simply sit by and watch as the world around us crumbles; we must take action to prevent it.	We cannot simply sit by and watch as the world around us crumbles; we must take action of some sort, though not necessarily to prevent the crumbling.
Mykonos has had a head start as far as diving is concerned because it was never banned here (after all, there are no ancient sites to protect).	1	Mykonos has had a head start as far as diving is concerned because it was never banned here like it was in other places (after all, there are no ancient sites to protect).	Mykonos has had a head start as far as diving is concerned because it was never banned here, regardless of whether there were bans in other places (after all, there are no ancient sites to protect).
The turkey is ready to eat.	1	The turkey is ready to be eaten.	The turkey is ready to be fed.
The company's profits have tripled since it began its expansion into new markets.	1	The company's profits have tripled because it began its expansion into new markets.	The company's profits have tripled after it began its expansion into new markets, though the relationship is not necessarily causal.
I would like to finish the book sometime this year.	1	I would like to finish reading the book sometime this year.	I would like to finish writing the book sometime this year.
The box is unlockable.	1	The box is not lockable.	The box can be unlocked.
She told me her mom was in town two weeks ago.	1	She told me that two weeks ago, her mom was in town.	She told me two weeks ago that her mom was in town.
The study found that children who were read to more frequently had better reading comprehension skills.	1	The study demonstrated that children who were read to more frequently had better reading comprehension skills.	The study concluded that children who were read to more frequently had better reading comprehension skills.
Inflation is often caused by an increase in the money supply.	1	Inflation is often, but not always, caused by an increase in the money supply.	Inflation is often, perhaps always, caused by an increase in the money supply.
In the early days of the internet, web pages were simple and focused on delivering information.	1	In the early days of the internet, web pages were simple and focused on delivering information, which is not the case anymore.	At least in the early days of the internet, web pages were simple and focused on delivering information.
She was very close to her grandmother.	1	She had a very close relationship with her grandmother.	She was physically very close to her grandmother.
What we need is a change in attitude.	1	All we need is a change in attitude.	We need a change in attitude.
Many people in the town are unemployed.	1	There are many individuals in the town who are unemployed.	Many people in the town are unemployed relative to the overall population.
He is the strongest basketball player in the NBA.	1	He is the best basketball player in the NBA.	He is the physically strongest basketball player in the NBA.
It is not unheard of for a business to make a profit in its first year.	1	It is unexpected, but not unheard of, for a business to make a profit in its first year.	There are known cases where a business makes a profit in its first year.
The painting is a copy of the original.	1	The painting is a reproduction of the original.	The painting is a photocopy of the original.
In a large company, a vice president may be the only person who knows the exact location of every piece of equipment.	1	In a large company, a vice president knows the exact location of every piece of equipment, and may be the only one. 	In a large company, the vice president is the only one who might knowing the exact location of every piece of equipment.
I try to avoid talking to people when I'm in a bad mood.	1	I try to avoid talking to people when I'm in a bad mood, but not when I'm in a good mood.	I try to avoid talking to people when I'm in a bad mood, though I might when in a good mood too.
I saw a crane on my walk.	1	I saw a construction crane on my walk.	I saw a crane, as in the bird, on my walk.
Jenny and Zoe solved the puzzle.	1	Jenny and Zoe each solved the puzzle.	Jenny and Zoe solved the puzzle together.
After the battle, the knight found the body of the princess.	1	After the battle, the knight discovered that the princess had been killed in battle when he found her body.	After the battle, the knight located the body of the princess, who may have been dead since before the battle.
It is important to remember that you are not alone.	1	It is important to remember that you are not physically alone.	It is important to remember that you are not figuratively alone in this situation.
After the fire, the family was homeless and had to live in a hotel.	1	Due to the fire, the family became homeless and had to live in a hotel.	In the time after the fire, the family was homeless and had to live in a hotel.
I am afraid that we will have to cancel tomorrow's picnic.	1	I am sorry to share that we will have to cancel tomorrow's picnic.	I am worried that we will have to cancel tomorrow's picnic.
The crowd turned to the man on the stage.	1	The crowd turned to look at the man on the stage.	The crowd turned their bodies toward the man on the stage.
It can be inferred from this that he is not interested in the meeting.	1	This shows that he is not interested in the meeting.	One might infer from this that he is not interested in the meeting.
I don't like to drink coffee.	1	I don't like to drink coffee, which is why I don't.	I don't like to drink coffee, whether or not I actually drink it.
I don't think that the glass is half empty.	1	I don't think that the glass is half empty, metaphorically.	I don't think that the glass is exactly half empty.
I have to complete this report by 5 p.m.	1	I have to complete this report by 5 p.m. today.	I have to complete this report by 5 p.m. on the day that it's due
They found that the more TV people watched, the more likely they were to be obese.	1	They found that the more TV people watched, the more likely they were to become obese.	They found that the more TV people watched, the the more likely it was that they were obese.
The fact that he was able to do it without any training is a testament to his natural ability.	1	The fact that he was able to do it without any training is a testament to his natural ability alone.	The fact that he was able to do it without any training is a testament to his natural ability and possibly other attributes.
We haven't finished eating the cake yet.	1	We haven't finished eating the cake yet, but we've started.	We haven't finished eating the cake yet, but we've started.
They discovered that the plant had, for the first time, produced a new type of flower.	1	They discovered that the plant had produced a new type of flower, which it had never done before.	They discovered that the plant had produced a new type of flower that it had never produced before.
They wanted to make a statement about the way that the world is.	1	The statement they they wanted to make is about the way that the world is.	They wanted to make at least a statement about the way that the world is.
The fire started in the east wing of the building and spread quickly.	1	The fire originated in the east wing of the building and spread quickly.	The fire started its path through the building in the east wing and spread quickly.
The novel has been translated into more than twenty languages.	1	The novel has been translated into just over twenty languages.	The novel has been translated into more than twenty languages, possibly many more.
The burglar threatened the student with a knife.	1	The burglar used a knife to threaten the student.	The burglar threatened the student who has a knife.
Even if we do not agree with her methods, we must admire her for her tenacity.	1	Although we do not agree with her methods, we must admire her for her tenacity.	Even in the case that we do not agree with her methods, we must still admire her for her tenacity.
Many birds are attracted to the island because of the abundance of food.	1	Many birds are attracted to the island solely because of the abundance of food.	Many birds are attracted to the island in part because of the abundance of food.
Some people are under the impression that exercising in the morning is the best time to do so.	1	Some people are under the false impression that exercising in the morning is the best time to do so.	Some people believe that exercising in the morning is the best time to do so.
Social media has been shown to have a negative effect on self-esteem.	1	It has been revealed that social media has a negative effect on self-esteem.	Social media has been shown by some studies to have a negative effect on self-esteem.
A large number of people are employed in the tourism industry.	1	A large number of people in some group are employed in the tourism industry.	A large number of people in society are employed in the tourism industry.
One of the most important factors in the development of the American economy was the rise of the industry.	1	One of the most important factors in the development of the American economy was the rise of the industry, but it was not the single most important factor.	One of the most important factors, perhaps the single most important factor, in the development of the American economy was the rise of the industry.
If you have the correct tools, it's not difficult to fix the leaky faucet.	1	If you have the correct tools, it's not difficult to fix the leaky faucet; otherwise, it is difficult.	If you have the correct tools, it's not difficult to fix the leaky faucet; though it may not be difficult without tools, either.
